{"schema_version":"coh.secret-reference/v1","contract_version":"1.0.0","request_id":"0198d6c4-5555-7555-8555-555555555555","idempotency_key":"resolve-siem-readonly","context":{"organization_id":"0198d6c4-0b68-7c4f-908d-bb21b4e5ac9e","tenant_id":"0198d6c4-22dc-7b3c-af2c-75c1b8eb4f16","case_id":"0198d6c4-7618-7d31-8e0a-9da53cae8ca2","actor_id":"0198d6c4-1111-7111-8111-111111111111"},"action_digest":"sha256:aaaaaaaaaaaaaaaaaaaaaaaaaaaaaaaaaaaaaaaaaaaaaaaaaaaaaaaaaaaaaaaa","credential_class":"siem.readonly","reference":{"schema_version":"coh.secret-reference/v1","contract_version":"1.0.0","backend":"protected-file","entry_id":"siem.readonly","version":7}}
