{"schema_version":"coh.secret-reference/v1","contract_version":"1.0.0","request_id":"0198d6c4-6666-7666-8666-666666666666","idempotency_key":"resolve-ci-fixture","context":{"organization_id":"0198d6c4-0b68-7c4f-908d-bb21b4e5ac9e","tenant_id":"0198d6c4-22dc-7b3c-af2c-75c1b8eb4f16","case_id":"0198d6c4-7618-7d31-8e0a-9da53cae8ca2","actor_id":"0198d6c4-4444-7444-8444-444444444444"},"action_digest":"sha256:bbbbbbbbbbbbbbbbbbbbbbbbbbbbbbbbbbbbbbbbbbbbbbbbbbbbbbbbbbbbbbbb","credential_class":"test.fixture","reference":{"schema_version":"coh.secret-reference/v1","contract_version":"1.0.0","backend":"sealed-memory","entry_id":"ci.fixture","version":1}}
